name,brand,category,description,price,discount_percent,stock_quantity,authenticity,materials,dimensions,care_instructions,story,gender,is_active,is_featured,meta_title,meta_description,variant_name,variant_sku,variant_price_adjustment,variant_stock_quantity,variant_color,variant_material,variant_size,variant_weight
Hermès Carré 90 Silk Scarf,Hermès,Scarves,"Iconic silk twill scarf with equestrian motifs. Hand-rolled edges and vibrant colors.",450,0,8,original,"100% Silk Twill","90cm x 90cm","Dry clean only. Store flat in box.","Each Hermès scarf design tells a unique story through artful illustration.",Women,True,True,Hermès Carré 90 - Luxury Silk Scarf,"Classic Hermès silk scarf with hand-rolled edges",Equestrian Print,HER-CAR-90-EQU,0,5,Multicolor,Silk,90cm,125g
Louis Vuitton Monogram Shine Shawl,Louis Vuitton,Scarves,"Elegant shawl with subtle monogram pattern and shimmering thread details.",590,0,6,original,"Silk, Wool, Metallic Thread","140cm x 140cm","Dry clean recommended. Avoid direct sunlight.","Combines classic monogram with modern luxury shimmer.",Women,True,False,Louis Vuitton Monogram Shine Shawl - Luxury Wrap,"Louis Vuitton shawl with subtle monogram and metallic details",Noir/Gold,LV-MSS-140-BLK,0,4,Black/Gold,Silk Blend,140cm,180g
Gucci Flora Silk Scarf,Gucci,Scarves,"Vibrant floral print silk scarf with signature Gucci motifs.",420,0,7,original,"100% Silk","90cm x 90cm","Professional dry clean only. Store folded.","Features the iconic Flora print created for Grace Kelly in 1966.",Women,True,True,Gucci Flora Silk Scarf - Floral Luxury Accessory,"Gucci silk scarf with Flora print and signature details",Flora Print,GUC-FLO-90-FLR,0,4,Multicolor,Silk,90cm,120g
Burberry Check Cashmere Scarf,Burberry,Scarves,"Classic check pattern scarf in ultra-soft cashmere.",490,0,10,original,"100% Cashmere","168cm x 30cm","Dry clean or hand wash cold. Store clean.","Features Burberry's signature check pattern.",Unisex,True,True,Burberry Check Cashmere Scarf - Classic Luxury,"Burberry cashmere scarf with iconic check pattern",Classic Check,BUR-CHK-CAS-CHK,0,6,Beige,Cashmere,168cm,200g
Fendi FF Logo Silk Scarf,Fendi,Scarves,"Elegant silk scarf with repeating FF logo pattern.",420,0,5,original,"100% Silk","90cm x 90cm","Dry clean only. Avoid water contact.","Features Karl Lagerfeld's iconic FF logo design.",Women,True,False,Fendi FF Logo Silk Scarf - Designer Accessory,"Fendi silk scarf with signature FF logo pattern",Brown/Black,FEN-FF-90-BRN,0,3,Brown,Silk,90cm,115g
